{
  "architectural_entities": [
    {
      "entity_id": "entity:src/pcae/__init__.py",
      "entity_locator": {
        "locator_type": "file_path",
        "locator_value": "src/pcae/__init__.py"
      },
      "entity_name": "__init__.py",
      "entity_path": "src/pcae/__init__.py",
      "entity_role": "top_level_package_member",
      "entity_type": "source_file",
      "limitations": [
        {
          "limitation_description": "This prototype records top-level path existence only; it does not parse file contents, imports, or symbols.",
          "limitation_type": "scope_limitation"
        }
      ],
      "source_attribution": [
        {
          "source_claim_relationship": "documents",
          "source_id": "source:src/pcae/__init__.py",
          "source_limitations": [
            "Existence and path observed via deterministic filesystem listing at commit 0eedb51dd5fa15abdfbda69ba00f9fe902bffadc; file contents were not parsed."
          ],
          "source_locator": {
            "locator_type": "file_path",
            "locator_value": "src/pcae/__init__.py"
          },
          "source_staleness_state": "current",
          "source_support_level": "direct",
          "source_type": "file",
          "source_verification_state": "verified"
        }
      ],
      "verification_state": {
        "state_limitations": [
          "Verification is limited to path existence; semantic purpose or correctness was not verified."
        ],
        "state_reason": "Path existence observed via deterministic filesystem listing at generation commit.",
        "state_value": "verified",
        "supporting_sources": [],
        "timestamp_or_snapshot_context": {
          "context_type": "commit",
          "context_value": "0eedb51dd5fa15abdfbda69ba00f9fe902bffadc"
        }
      }
    },
    {
      "entity_id": "entity:src/pcae/__main__.py",
      "entity_locator": {
        "locator_type": "file_path",
        "locator_value": "src/pcae/__main__.py"
      },
      "entity_name": "__main__.py",
      "entity_path": "src/pcae/__main__.py",
      "entity_role": "top_level_package_member",
      "entity_type": "source_file",
      "limitations": [
        {
          "limitation_description": "This prototype records top-level path existence only; it does not parse file contents, imports, or symbols.",
          "limitation_type": "scope_limitation"
        }
      ],
      "source_attribution": [
        {
          "source_claim_relationship": "documents",
          "source_id": "source:src/pcae/__main__.py",
          "source_limitations": [
            "Existence and path observed via deterministic filesystem listing at commit 0eedb51dd5fa15abdfbda69ba00f9fe902bffadc; file contents were not parsed."
          ],
          "source_locator": {
            "locator_type": "file_path",
            "locator_value": "src/pcae/__main__.py"
          },
          "source_staleness_state": "current",
          "source_support_level": "direct",
          "source_type": "file",
          "source_verification_state": "verified"
        }
      ],
      "verification_state": {
        "state_limitations": [
          "Verification is limited to path existence; semantic purpose or correctness was not verified."
        ],
        "state_reason": "Path existence observed via deterministic filesystem listing at generation commit.",
        "state_value": "verified",
        "supporting_sources": [],
        "timestamp_or_snapshot_context": {
          "context_type": "commit",
          "context_value": "0eedb51dd5fa15abdfbda69ba00f9fe902bffadc"
        }
      }
    },
    {
      "entity_id": "entity:src/pcae/artifact_metadata.py",
      "entity_locator": {
        "locator_type": "file_path",
        "locator_value": "src/pcae/artifact_metadata.py"
      },
      "entity_name": "artifact_metadata.py",
      "entity_path": "src/pcae/artifact_metadata.py",
      "entity_role": "top_level_package_member",
      "entity_type": "source_file",
      "limitations": [
        {
          "limitation_description": "This prototype records top-level path existence only; it does not parse file contents, imports, or symbols.",
          "limitation_type": "scope_limitation"
        }
      ],
      "source_attribution": [
        {
          "source_claim_relationship": "documents",
          "source_id": "source:src/pcae/artifact_metadata.py",
          "source_limitations": [
            "Existence and path observed via deterministic filesystem listing at commit 0eedb51dd5fa15abdfbda69ba00f9fe902bffadc; file contents were not parsed."
          ],
          "source_locator": {
            "locator_type": "file_path",
            "locator_value": "src/pcae/artifact_metadata.py"
          },
          "source_staleness_state": "current",
          "source_support_level": "direct",
          "source_type": "file",
          "source_verification_state": "verified"
        }
      ],
      "verification_state": {
        "state_limitations": [
          "Verification is limited to path existence; semantic purpose or correctness was not verified."
        ],
        "state_reason": "Path existence observed via deterministic filesystem listing at generation commit.",
        "state_value": "verified",
        "supporting_sources": [],
        "timestamp_or_snapshot_context": {
          "context_type": "commit",
          "context_value": "0eedb51dd5fa15abdfbda69ba00f9fe902bffadc"
        }
      }
    },
    {
      "entity_id": "entity:src/pcae/cli.py",
      "entity_locator": {
        "locator_type": "file_path",
        "locator_value": "src/pcae/cli.py"
      },
      "entity_name": "cli.py",
      "entity_path": "src/pcae/cli.py",
      "entity_role": "top_level_package_member",
      "entity_type": "source_file",
      "limitations": [
        {
          "limitation_description": "This prototype records top-level path existence only; it does not parse file contents, imports, or symbols.",
          "limitation_type": "scope_limitation"
        }
      ],
      "source_attribution": [
        {
          "source_claim_relationship": "documents",
          "source_id": "source:src/pcae/cli.py",
          "source_limitations": [
            "Existence and path observed via deterministic filesystem listing at commit 0eedb51dd5fa15abdfbda69ba00f9fe902bffadc; file contents were not parsed."
          ],
          "source_locator": {
            "locator_type": "file_path",
            "locator_value": "src/pcae/cli.py"
          },
          "source_staleness_state": "current",
          "source_support_level": "direct",
          "source_type": "file",
          "source_verification_state": "verified"
        }
      ],
      "verification_state": {
        "state_limitations": [
          "Verification is limited to path existence; semantic purpose or correctness was not verified."
        ],
        "state_reason": "Path existence observed via deterministic filesystem listing at generation commit.",
        "state_value": "verified",
        "supporting_sources": [],
        "timestamp_or_snapshot_context": {
          "context_type": "commit",
          "context_value": "0eedb51dd5fa15abdfbda69ba00f9fe902bffadc"
        }
      }
    },
    {
      "entity_id": "entity:src/pcae/commands",
      "entity_locator": {
        "locator_type": "file_path",
        "locator_value": "src/pcae/commands"
      },
      "entity_name": "commands",
      "entity_path": "src/pcae/commands",
      "entity_role": "top_level_package_member",
      "entity_type": "module",
      "limitations": [
        {
          "limitation_description": "This prototype records top-level path existence only; it does not parse file contents, imports, or symbols.",
          "limitation_type": "scope_limitation"
        }
      ],
      "source_attribution": [
        {
          "source_claim_relationship": "documents",
          "source_id": "source:src/pcae/commands",
          "source_limitations": [
            "Existence and path observed via deterministic filesystem listing at commit 0eedb51dd5fa15abdfbda69ba00f9fe902bffadc; file contents were not parsed."
          ],
          "source_locator": {
            "locator_type": "file_path",
            "locator_value": "src/pcae/commands"
          },
          "source_staleness_state": "current",
          "source_support_level": "direct",
          "source_type": "file",
          "source_verification_state": "verified"
        }
      ],
      "verification_state": {
        "state_limitations": [
          "Verification is limited to path existence; semantic purpose or correctness was not verified."
        ],
        "state_reason": "Path existence observed via deterministic filesystem listing at generation commit.",
        "state_value": "verified",
        "supporting_sources": [],
        "timestamp_or_snapshot_context": {
          "context_type": "commit",
          "context_value": "0eedb51dd5fa15abdfbda69ba00f9fe902bffadc"
        }
      }
    },
    {
      "entity_id": "entity:src/pcae/core",
      "entity_locator": {
        "locator_type": "file_path",
        "locator_value": "src/pcae/core"
      },
      "entity_name": "core",
      "entity_path": "src/pcae/core",
      "entity_role": "top_level_package_member",
      "entity_type": "module",
      "limitations": [
        {
          "limitation_description": "This prototype records top-level path existence only; it does not parse file contents, imports, or symbols.",
          "limitation_type": "scope_limitation"
        }
      ],
      "source_attribution": [
        {
          "source_claim_relationship": "documents",
          "source_id": "source:src/pcae/core",
          "source_limitations": [
            "Existence and path observed via deterministic filesystem listing at commit 0eedb51dd5fa15abdfbda69ba00f9fe902bffadc; file contents were not parsed."
          ],
          "source_locator": {